id,name,category,implementation_year,description,implementing_agency,budget,objectives,latest_score,assessment_count
HDB-001,Housing Development Act,Phát triển đô thị,1960,Comprehensive public housing program for Singapore residents,Housing & Development Board,,Provide affordable housing; Urban planning; Community development,5.0,2
CPF-001,Central Provident Fund,An sinh xã hội,1955,Mandatory savings scheme for retirement and healthcare,CPF Board,,Retirement savings; Healthcare coverage; Housing finance,4.428571428571429,1
GST-001,Goods and Services Tax,Thuế,1994,Consumption tax system for government revenue,Inland Revenue Authority of Singapore,,Government revenue; Tax efficiency; Economic growth,3.642857142857143,2
EDU-001,SkillsFuture Initiative,Giáo dục,2015,National movement to provide opportunities for lifelong learning,SkillsFuture Singapore,,Lifelong learning; Skills upgrading; Economic competitiveness,3.9285714285714284,1
HC-001,Medisave Scheme,Chăm sóc sức khỏe,1984,Medical savings account for healthcare expenses,Ministry of Health,,Healthcare financing; Medical cost control; Health security,3.7857142857142856,1
DEMO-001,Digital Government Services Initiative,Phát triển đô thị,2023,Comprehensive digitalization of government services,Government Technology Agency,,Digital transformation; Service efficiency; Citizen convenience,3.7857142857142856,1
